{"contract":1,"plans":[{"goal":"","id":"fix","indicators":[],"kind":"fix","parent":null,"progress":{"src":"ledger: (done + resolved) / every card in scope","value":0.0},"state":"registered","steps":[{"depends_on":[],"gate":"Every card here passes its acceptance command, and the next audit raises none of these claims.","id":"M01","state":"todo","sub_plan":null,"tasks":[{"acceptance":null,"depends_on":[],"id":"TASK-001","state":"todo","title":"Dead code: app/old_export.py (no production entry point reaches it)"},{"acceptance":null,"depends_on":[],"id":"TASK-002","state":"todo","title":"Dead code: app/old_mail.py (no production entry point reaches it)"},{"acceptance":null,"depends_on":[],"id":"TASK-003","state":"todo","title":"Dead code: app/old_report.py (no production entry point reaches it)"}],"title":"No known-vulnerable version, broken reference, dead code or open access gap remains.","weight":3}],"title":"Fix plan"}],"provenance":{"assistant":null,"at":null,"confidence":null,"departures":[],"message":{"ar":"المثالي المعروض هو هدف القواعد، وما خُطِّط بعد: أعد تخطيطه من مركز التحكم بمساعدك (Claude Code أو Codex).","en":"The ideal shown is the rules' target. It is not planned yet: re-plan it from the command centre with your assistant (Claude Code or Codex)."},"method":"rules","model":null,"open_questions":[],"state":"not_planned"},"schema_version":1}